Article 11 - Nuisances,Sec. 625.5(c(1)) - Enforcement Subsection,"All actual damages (including, but not limited to, lost pay and",Must comply with section provisions.,SF Health Code Sec. 625.5(c(1)),Owner/Responsible Party,199
Article 11 - Nuisances,Sec. 625.5(c(2)) - Enforcement Subsection,"Exemplary damages, as authorized under California Civil Code",Must comply with section provisions.,SF Health Code Sec. 625.5(c(2)),Owner/Responsible Party,200
Article 11 - Nuisances,Sec. 625.5(c(3)) - Enforcement Subsection,The court shall award reasonable attorneys' fees and costs to an,Must comply with section provisions.,SF Health Code Sec. 625.5(c(3)),Owner/Responsible Party,201
Article 11 - Nuisances,Sec. 625.5(d) - Enforcement Subsection,Nothing in this Article,Must comply with section provisions.,SF Health Code Sec. 625.5(d),Owner/Responsible Party,202
Article 11 - Nuisances,Sec. 625.6 - Undertaking For The General Welfare,Refer to full code text.,Must comply with section provisions.,SF Health Code Sec. 625.6,Owner/Responsible Party,203
Article 11 - Nuisances,Sec. 625.7 - Severability,Refer to full code text.,Must comply with section provisions.,SF Health Code Sec. 625.7,Owner/Responsible Party,204